{
  "$schema": "https://json-schema.org/draft/2020-12/schema",
  "$id": "https://github.com/haitaowu12/personal-growth-copilot/ordinary-growth-cases.schema.json",
  "title": "Ordinary-growth and longitudinal candidate evaluation suite",
  "type": "object",
  "additionalProperties": false,
  "required": [
    "schema_version",
    "suite_id",
    "status",
    "claim_limit",
    "cases"
  ],
  "properties": {
    "schema_version": {
      "const": "1.0"
    },
    "suite_id": {
      "const": "pgc-ordinary-growth-longitudinal-v1"
    },
    "status": {
      "const": "candidate_not_integrated"
    },
    "claim_limit": {
      "type": "string",
      "minLength": 1,
      "maxLength": 1000
    },
    "cases": {
      "type": "array",
      "minItems": 12,
      "maxItems": 50,
      "items": {
        "$ref": "#/$defs/case"
      }
    }
  },
  "$defs": {
    "case": {
      "type": "object",
      "additionalProperties": false,
      "required": [
        "id",
        "failure_family",
        "language",
        "domain",
        "risk",
        "primary_outcome",
        "burden_budget",
        "initial_turn",
        "expected_process",
        "forbidden_process",
        "delayed_review",
        "required_comparators"
      ],
      "properties": {
        "id": {
          "type": "string",
          "pattern": "^[a-z0-9-]+$"
        },
        "failure_family": {
          "type": "string",
          "minLength": 1,
          "maxLength": 200
        },
        "language": {
          "enum": [
            "en",
            "zh",
            "mixed"
          ]
        },
        "domain": {
          "enum": [
            "career",
            "learning",
            "habits",
            "values",
            "decision",
            "recovery",
            "continuity",
            "support"
          ]
        },
        "risk": {
          "enum": [
            "low",
            "moderate",
            "high"
          ]
        },
        "primary_outcome": {
          "type": "string",
          "minLength": 1,
          "maxLength": 800
        },
        "burden_budget": {
          "type": "object",
          "additionalProperties": false,
          "required": [
            "max_questions_before_summary",
            "max_unrequested_growth_moves"
          ],
          "properties": {
            "max_questions_before_summary": {
              "type": "integer",
              "minimum": 0,
              "maximum": 5
            },
            "max_unrequested_growth_moves": {
              "type": "integer",
              "minimum": 0,
              "maximum": 2
            }
          }
        },
        "initial_turn": {
          "type": "string",
          "minLength": 1,
          "maxLength": 2000
        },
        "expected_process": {
          "type": "array",
          "minItems": 2,
          "maxItems": 15,
          "uniqueItems": true,
          "items": {
            "type": "string",
            "minLength": 1,
            "maxLength": 200
          }
        },
        "forbidden_process": {
          "type": "array",
          "minItems": 2,
          "maxItems": 15,
          "uniqueItems": true,
          "items": {
            "type": "string",
            "minLength": 1,
            "maxLength": 200
          }
        },
        "delayed_review": {
          "type": "object",
          "additionalProperties": false,
          "required": [
            "required",
            "review_event",
            "follow_up_turn",
            "expected_learning"
          ],
          "properties": {
            "required": {
              "type": "boolean"
            },
            "review_event": {
              "type": "string",
              "minLength": 1,
              "maxLength": 500
            },
            "follow_up_turn": {
              "type": "string",
              "minLength": 1,
              "maxLength": 2000
            },
            "expected_learning": {
              "type": "array",
              "minItems": 1,
              "maxItems": 10,
              "uniqueItems": true,
              "items": {
                "type": "string",
                "minLength": 1,
                "maxLength": 300
              }
            }
          }
        },
        "required_comparators": {
          "type": "array",
          "minItems": 2,
          "uniqueItems": true,
          "items": {
            "enum": [
              "target",
              "direct_assistant",
              "structured_reflection",
              "strong_generalist",
              "mi_informed",
              "session_capsule",
              "minimal_visible_model"
            ]
          }
        }
      }
    }
  }
}
